{
  "schema_version": "1.0",
  "experiment_id": "brazil_sp_environment_dual_track_rule_cards",
  "version": "0.1.0",
  "pack_id": "brazil_new_energy_greenfield",
  "jurisdiction": {
    "country": "BR",
    "state": "SP"
  },
  "industry": "new_energy_manufacturing",
  "action_type": "greenfield_plant",
  "status": "evidence_only",
  "certification_status": "provisional",
  "runtime_integration": false,
  "as_of": "2026-07-17",
  "disclaimer": "本实验仅比较规则卡抽取方法，不构成巴西法律意见，不证明法规现行效力、个案适用性或许可结果；全部卡片须由巴西执业律师逐项复核后方可考虑进入生产。",
  "methodology": {
    "sample_size": 10,
    "tracks": [
      "statute_forward",
      "form_reverse"
    ],
    "selection_rationale": "以圣保罗州工业绿地项目环境许可为窄范围样本，选择法规触发条件与 CETESB 官方申请页面可直接核验的操作字段进行双轨比较。",
    "comparison_question": "从法规条文向事实拆解，与从官方申请流程反推材料字段，是否会暴露不同的事实缺口、分支逻辑与证据要求？",
    "generalisability_notice": "这是 n=10、单州、单主题实验，不能证明对巴西其他州、其他行业或第二个能力包具有通用性；差异类型仍是 provisional taxonomy。",
    "time_capture_method": "not_measured",
    "time_capture_reason": "实验整理过程中未启动逐轨、逐卡的同期计时器；禁止用回忆或估算补填工时，因此所有分钟字段保持 null。"
  },
  "timing": {
    "statute_forward_total_minutes": null,
    "form_reverse_total_minutes": null,
    "unavailable_reason": "未进行同期计时，无法可靠区分法条检索、表单核验、翻译和结构化录入耗时；不使用事后估算。"
  },
  "source_registry": [
    {
      "source_id": "alsp-lei-997-1976",
      "authority": "Assembleia Legislativa do Estado de São Paulo",
      "instrument_type": "state_law",
      "title": "Lei nº 997, de 31 de maio de 1976 — controle da poluição do meio ambiente",
      "official_url": "https://www.al.sp.gov.br/repositorio/legislacao/lei/1976/compilacao-lei-997-31.05.1976.html",
      "official_host": "www.al.sp.gov.br",
      "access_verified_at": "2026-07-17",
      "access_status": "verified_official_html",
      "usable_pinpoints": [
        "Art. 5º, caput e §§ 1º-4º",
        "Art. 6º"
      ],
      "review_status": "provisional"
    },
    {
      "source_id": "alsp-decreto-8468-1976",
      "authority": "Governo do Estado de São Paulo / Assembleia Legislativa do Estado de São Paulo",
      "instrument_type": "state_decree",
      "title": "Decreto nº 8.468, de 8 de setembro de 1976 — Regulamento da Lei nº 997/1976",
      "official_url": "https://www.al.sp.gov.br/repositorio/legislacao/decreto/1976/decreto-8468-08.09.1976.html",
      "official_host": "www.al.sp.gov.br",
      "access_verified_at": "2026-07-17",
      "access_status": "verified_official_html",
      "usable_pinpoints": [
        "Art. 57, II",
        "Art. 58, II-IV"
      ],
      "review_status": "provisional"
    },
    {
      "source_id": "cetesb-pla-faq",
      "authority": "Companhia Ambiental do Estado de São Paulo — CETESB",
      "instrument_type": "official_application_guidance",
      "title": "Dúvidas sobre o Portal de Licenciamento Ambiental — PLA",
      "official_url": "https://cetesb.sp.gov.br/licenciamentoambiental/duvidas-sobre-o-portal-de-licenciamento-ambiental-pla/",
      "official_host": "cetesb.sp.gov.br",
      "access_verified_at": "2026-07-17",
      "access_status": "verified_official_html",
      "usable_pinpoints": [
        "FAQ itens 1-2",
        "FAQ item 6",
        "FAQ itens 9 e 11",
        "FAQ itens 13-16"
      ],
      "review_status": "provisional"
    },
    {
      "source_id": "cetesb-e-portal",
      "authority": "Companhia Ambiental do Estado de São Paulo — CETESB",
      "instrument_type": "official_service_portal",
      "title": "e-CETESB — Portal de Serviços / Sistema de Licenciamento Ambiental",
      "official_url": "https://e.cetesb.sp.gov.br/portal-servicos-frontend/",
      "official_host": "e.cetesb.sp.gov.br",
      "access_verified_at": "2026-07-17",
      "access_status": "verified_official_service",
      "usable_pinpoints": [
        "Portal de Serviços — Sistema de Licenciamento Ambiental"
      ],
      "review_status": "provisional"
    }
  ],
  "excluded_sources": [
    {
      "url": "https://www.cetesb.sp.gov.br/licenciamento/pdf/Industrias_LI.pdf",
      "reason": "该历史官方 PDF 在 2026-07-17 直接访问时重定向至 CETESB 首页；搜索索引摘要不足以证明当前通用工业清单，故不用于规则主张。",
      "decision": "not_used_for_rule_claims"
    },
    {
      "url": "https://licenciamento.cetesb.sp.gov.br/cogeracao_energia_texto.asp",
      "reason": "该页面是热电联产活动的专项清单，不能无依据外推到全部新能源制造绿地工厂。",
      "decision": "not_used_for_rule_claims"
    }
  ],
  "cards": [
    {
      "rule_id": "BR-SP-ENV-RC-001",
      "pack_id": "brazil_new_energy_greenfield",
      "version": "0.1.0",
      "title": "工业活动作为污染源的初步分类",
      "certification_status": "provisional",
      "production_ready": false,
      "non_legal_opinion": true,
      "citations": [
        {
          "source_id": "alsp-decreto-8468-1976",
          "official_url": "https://www.al.sp.gov.br/repositorio/legislacao/decreto/1976/decreto-8468-08.09.1976.html",
          "pinpoint": "Art. 57, II",
          "claim_scope": "条文将工业活动列入为取得安装和运行许可而考虑的污染源类别。",
          "access_verified_at": "2026-07-17"
        },
        {
          "source_id": "cetesb-pla-faq",
          "official_url": "https://cetesb.sp.gov.br/licenciamentoambiental/duvidas-sobre-o-portal-de-licenciamento-ambiental-pla/",
          "pinpoint": "FAQ item 14 — MCE import",
          "claim_scope": "官方申请流程使用 Memorial de Caracterização do Empreendimento（MCE），且对必填值进行校验。",
          "access_verified_at": "2026-07-17"
        }
      ],
      "elements": [
        {
          "element_id": "activity_is_industrial",
          "statement": "拟议活动属于工业活动，进入污染源许可适用性判断。",
          "source_track": "statute_forward"
        },
        {
          "element_id": "mce_is_application_artifact",
          "statement": "申请流程要求使用与项目特征相关的 MCE 文件，具体字段需以当次门户为准。",
          "source_track": "form_reverse"
        }
      ],
      "fact_fields": [
        {
          "field_id": "industrial_activity_description",
          "label": "工业活动与工艺描述",
          "value_type": "string",
          "introduced_by": "statute_forward",
          "required_state": "required",
          "evidence_hint": "项目工艺说明；是否属于 art. 57, II 仍待律师复核"
        },
        {
          "field_id": "mce_file",
          "label": "本次申请生成或填写的 MCE",
          "value_type": "document",
          "introduced_by": "form_reverse",
          "required_state": "conditional",
          "evidence_hint": "仅接受 e-CETESB 当前流程生成或接受的文件"
        },
        {
          "field_id": "mce_required_fields_complete",
          "label": "MCE 必填值是否通过门户校验",
          "value_type": "boolean",
          "introduced_by": "form_reverse",
          "required_state": "conditional",
          "evidence_hint": "门户校验结果；FAQ 未枚举全部字段"
        }
      ],
      "exceptions": [],
      "exception_review_note": "所引 pinpoint 未提供可安全自动化的工业类别例外；不得据此认定所有制造活动必然采用同一路径。",
      "consequence": "命中后仅进入 CETESB 许可适用性和 MCE 材料核验队列，不自动作出应许可或可运营结论。",
      "red_flag": {
        "severity": "high",
        "condition": "项目属于工业制造但无法提供工艺描述，或试图复用未通过当前门户校验的旧 MCE。",
        "response": "阻止自动清场，要求补充工艺事实并由巴西律师确认许可路径。"
      },
      "difference_type": "scope_to_form_fields",
      "difference_summary": "法条轨给出工业活动这一适用类别；表单轨暴露 MCE 这一操作性材料，但当前 FAQ 不足以枚举其全部字段。",
      "production_tracks": {
        "statute_forward": {
          "status": "completed_provisional",
          "source_ids": [
            "alsp-decreto-8468-1976"
          ],
          "required_facts": [
            "industrial_activity_description"
          ],
          "derived_output": "生成“是否属于 art. 57, II 工业活动”的律师复核问题。",
          "effort_minutes": null,
          "effort_unavailable_reason": "未对本卡法条轨进行同期计时，禁止事后估算。"
        },
        "form_reverse": {
          "status": "partial_provisional",
          "source_ids": [
            "cetesb-pla-faq"
          ],
          "required_facts": [
            "mce_file",
            "mce_required_fields_complete"
          ],
          "derived_output": "生成 MCE 文件和门户必填校验的材料缺口，不推断未公开字段。",
          "effort_minutes": null,
          "effort_unavailable_reason": "未对本卡表单轨进行同期计时，禁止事后估算。"
        }
      },
      "open_questions": [
        "新能源电池或储能制造在当前 CETESB 分类中对应哪些具体 MCE 分支和字段？"
      ]
    },
    {
      "rule_id": "BR-SP-ENV-RC-002",
      "pack_id": "brazil_new_energy_greenfield",
      "version": "0.1.0",
      "title": "新建、重建或改造工业建筑的安装许可触发事实",
      "certification_status": "provisional",
      "production_ready": false,
      "non_legal_opinion": true,
      "citations": [
        {
          "source_id": "alsp-decreto-8468-1976",
          "official_url": "https://www.al.sp.gov.br/repositorio/legislacao/decreto/1976/decreto-8468-08.09.1976.html",
          "pinpoint": "Art. 58, II",
          "claim_scope": "条文涵盖为安装污染源而新建、重建或改造建筑的情形。",
          "access_verified_at": "2026-07-17"
        },
        {
          "source_id": "cetesb-pla-faq",
          "official_url": "https://cetesb.sp.gov.br/licenciamentoambiental/duvidas-sobre-o-portal-de-licenciamento-ambiental-pla/",
          "pinpoint": "FAQ item 16 — property address and geographic positioning",
          "claim_scope": "申请流程要求登记项目所在地与按申请类型变化的地理定位事实。",
          "access_verified_at": "2026-07-17"
        }
      ],
      "elements": [
        {
          "element_id": "building_work_for_pollution_source",
          "statement": "存在新建、重建或改造拟用于污染源安装的建筑工程。",
          "source_track": "statute_forward"
        },
        {
          "element_id": "property_location_recorded",
          "statement": "申请需关联具体物业地址，并在门户要求时提供地理定位。",
          "source_track": "form_reverse"
        }
      ],
      "fact_fields": [
        {
          "field_id": "building_work_type",
          "label": "建筑工程类型",
          "value_type": "enum",
          "introduced_by": "statute_forward",
          "required_state": "required",
          "evidence_hint": "new_build / reconstruction / reform / none"
        },
        {
          "field_id": "building_intended_use",
          "label": "建筑拟承载的污染源或生产用途",
          "value_type": "string",
          "introduced_by": "statute_forward",
          "required_state": "required",
          "evidence_hint": "建设与工艺设计文件"
        },
        {